{
  "$schema": "https://json-schema.org/draft/2020-12/schema",
  "$id": "https://aoa.local/mechanics/experience/parts/capture-kernel/schemas/cross_repo_experience_signal_v1.json",
  "title": "cross_repo_experience_signal_v1",
  "type": "object",
  "required": [
    "schema_version",
    "kind",
    "id",
    "status",
    "summary",
    "evidence_refs",
    "payload",
    "owner_repo"
  ],
  "properties": {
    "schema_version": {
      "type": "string",
      "const": "1.0"
    },
    "kind": {
      "type": "string",
      "const": "cross_repo_experience_signal"
    },
    "id": {
      "type": "string",
      "minLength": 3
    },
    "status": {
      "type": "string",
      "enum": [
        "draft",
        "captured",
        "candidate",
        "review",
        "approved",
        "blocked",
        "rejected",
        "promoted",
        "active",
        "retired",
        "scheduled",
        "passed",
        "failed"
      ]
    },
    "summary": {
      "type": "string",
      "minLength": 1
    },
    "owner_repo": {
      "type": "string"
    },
    "evidence_refs": {
      "type": "array",
      "items": {
        "type": "string"
      },
      "minItems": 1
    },
    "payload": {
      "type": "object",
      "required": [
        "repo",
        "family",
        "surface",
        "severity",
        "release_id"
      ],
      "additionalProperties": false,
      "properties": {
        "repo": {
          "type": "string"
        },
        "family": {
          "type": "string"
        },
        "surface": {
          "type": "string"
        },
        "severity": {
          "type": "string"
        },
        "release_id": {
          "type": "string"
        }
      }
    }
  },
  "additionalProperties": false
}
